{
  "schema_version": "1.0.0",
  "analysis_type": "policy_optimization",
  "id": "transition-optimization",
  "title": "Transition policy optimization",
  "spec": {
    "schema_version": "1.0.0",
    "analysis_type": "policy_optimization_specification",
    "id": "transition-optimization",
    "title": "Transition policy optimization",
    "description": "Illustrative multi-objective transition design.",
    "variables": {
      "carbon_price": {
        "schema_version": "1.0.0",
        "record_type": "policy_decision_variable",
        "id": "carbon_price",
        "label": "Carbon price",
        "target": "policy$e",
        "lower": 0,
        "upper": 20,
        "initial": 10,
        "step": 5,
        "type": "continuous",
        "unit": "index",
        "description": ""
      },
      "investment": {
        "schema_version": "1.0.0",
        "record_type": "policy_decision_variable",
        "id": "investment",
        "label": "Transition investment",
        "target": "policy$a",
        "lower": 0,
        "upper": 20,
        "initial": 10,
        "step": 5,
        "type": "continuous",
        "unit": "index",
        "description": ""
      }
    },
    "objectives": {
      "emissions": {
        "schema_version": "1.0.0",
        "record_type": "policy_objective",
        "id": "emissions",
        "label": "Minimize emissions",
        "metric": "emissions",
        "direction": "minimize",
        "weight": 0.65,
        "target": null,
        "tolerance": null,
        "unit": "MtCO2e"
      },
      "cost": {
        "schema_version": "1.0.0",
        "record_type": "policy_objective",
        "id": "cost",
        "label": "Minimize cost",
        "metric": "cost",
        "direction": "minimize",
        "weight": 0.35,
        "target": null,
        "tolerance": null,
        "unit": "index"
      }
    },
    "constraints": {
      "jobs-floor": {
        "schema_version": "1.0.0",
        "record_type": "policy_constraint",
        "id": "jobs-floor",
        "label": "Protect jobs",
        "metric": "jobs",
        "operator": ">=",
        "value": 48,
        "lower": null,
        "upper": null,
        "tolerance": 1e-08,
        "hard": true
      },
      "emissions-target": {
        "schema_version": "1.0.0",
        "record_type": "policy_constraint",
        "id": "emissions-target",
        "label": "Meet emissions target",
        "metric": "emissions",
        "operator": "<=",
        "value": 70,
        "lower": null,
        "upper": null,
        "tolerance": 1e-08,
        "hard": true
      }
    },
    "method": "grid",
    "max_evaluations": 100,
    "seed": 13,
    "metadata": {}
  },
  "candidates": [
    {
      "candidate_id": "candidate-1",
      "carbon_price": 0,
      "investment": 0,
      "cost": 100,
      "emissions": 120,
      "jobs": 50.0,
      "resilience": 40.0,
      "feasible": false,
      "constraint_violations": 1,
      "total_violation": 50,
      "evaluation_status": "success",
      "error": "",
      "objective_score": null,
      "pareto": false
    },
    {
      "candidate_id": "candidate-2",
      "carbon_price": 0,
      "investment": 5,
      "cost": 115,
      "emissions": 95,
      "jobs": 57.5,
      "resilience": 45.0,
      "feasible": false,
      "constraint_violations": 1,
      "total_violation": 25,
      "evaluation_status": "success",
      "error": "",
      "objective_score": null,
      "pareto": false
    },
    {
      "candidate_id": "candidate-3",
      "carbon_price": 0,
      "investment": 10,
      "cost": 130,
      "emissions": 70,
      "jobs": 65.0,
      "resilience": 50.0,
      "feasible": true,
      "constraint_violations": 0,
      "total_violation": 0,
      "evaluation_status": "success",
      "error": "",
      "objective_score": 0.5744444444444444,
      "pareto": true
    },
    {
      "candidate_id": "candidate-4",
      "carbon_price": 0,
      "investment": 15,
      "cost": 145,
      "emissions": 45,
      "jobs": 72.5,
      "resilience": 55.0,
      "feasible": true,
      "constraint_violations": 0,
      "total_violation": 0,
      "evaluation_status": "success",
      "error": "",
      "objective_score": 0.5366666666666666,
      "pareto": false
    },
    {
      "candidate_id": "candidate-5",
      "carbon_price": 0,
      "investment": 20,
      "cost": 160,
      "emissions": 20,
      "jobs": 80.0,
      "resilience": 60.0,
      "feasible": true,
      "constraint_violations": 0,
      "total_violation": 0,
      "evaluation_status": "success",
      "error": "",
      "objective_score": 0.4988888888888888,
      "pareto": false
    },
    {
      "candidate_id": "candidate-6",
      "carbon_price": 5,
      "investment": 0,
      "cost": 110,
      "emissions": 100,
      "jobs": 48.75,
      "resilience": 41.25,
      "feasible": false,
      "constraint_violations": 1,
      "total_violation": 30,
      "evaluation_status": "success",
      "error": "",
      "objective_score": null,
      "pareto": false
    },
    {
      "candidate_id": "candidate-7",
      "carbon_price": 5,
      "investment": 5,
      "cost": 125,
      "emissions": 75,
      "jobs": 56.25,
      "resilience": 46.25,
      "feasible": false,
      "constraint_violations": 1,
      "total_violation": 5,
      "evaluation_status": "success",
      "error": "",
      "objective_score": null,
      "pareto": false
    },
    {
      "candidate_id": "candidate-8",
      "carbon_price": 5,
      "investment": 10,
      "cost": 140,
      "emissions": 50,
      "jobs": 63.75,
      "resilience": 51.25,
      "feasible": true,
      "constraint_violations": 0,
      "total_violation": 0,
      "evaluation_status": "success",
      "error": "",
      "objective_score": 0.5372222222222223,
      "pareto": true
    },
    {
      "candidate_id": "candidate-9",
      "carbon_price": 5,
      "investment": 15,
      "cost": 155,
      "emissions": 25,
      "jobs": 71.25,
      "resilience": 56.25,
      "feasible": true,
      "constraint_violations": 0,
      "total_violation": 0,
      "evaluation_status": "success",
      "error": "",
      "objective_score": 0.49944444444444447,
      "pareto": false
    },
    {
      "candidate_id": "candidate-10",
      "carbon_price": 5,
      "investment": 20,
      "cost": 170,
      "emissions": 0,
      "jobs": 78.75,
      "resilience": 61.25,
      "feasible": true,
      "constraint_violations": 0,
      "total_violation": 0,
      "evaluation_status": "success",
      "error": "",
      "objective_score": 0.46166666666666667,
      "pareto": false
    },
    {
      "candidate_id": "candidate-11",
      "carbon_price": 10,
      "investment": 0,
      "cost": 120,
      "emissions": 80,
      "jobs": 47.5,
      "resilience": 42.5,
      "feasible": false,
      "constraint_violations": 2,
      "total_violation": 10.5,
      "evaluation_status": "success",
      "error": "",
      "objective_score": null,
      "pareto": false
    },
    {
      "candidate_id": "candidate-12",
      "carbon_price": 10,
      "investment": 5,
      "cost": 135,
      "emissions": 55,
      "jobs": 55.0,
      "resilience": 47.5,
      "feasible": true,
      "constraint_violations": 0,
      "total_violation": 0,
      "evaluation_status": "success",
      "error": "",
      "objective_score": 0.5377777777777778,
      "pareto": true
    },
    {
      "candidate_id": "candidate-13",
      "carbon_price": 10,
      "investment": 10,
      "cost": 150,
      "emissions": 30,
      "jobs": 62.5,
      "resilience": 52.5,
      "feasible": true,
      "constraint_violations": 0,
      "total_violation": 0,
      "evaluation_status": "success",
      "error": "",
      "objective_score": 0.5,
      "pareto": true
    },
    {
      "candidate_id": "candidate-14",
      "carbon_price": 10,
      "investment": 15,
      "cost": 165,
      "emissions": 5,
      "jobs": 70.0,
      "resilience": 57.5,
      "feasible": true,
      "constraint_violations": 0,
      "total_violation": 0,
      "evaluation_status": "success",
      "error": "",
      "objective_score": 0.4622222222222222,
      "pareto": true
    },
    {
      "candidate_id": "candidate-15",
      "carbon_price": 10,
      "investment": 20,
      "cost": 180,
      "emissions": -20,
      "jobs": 77.5,
      "resilience": 62.5,
      "feasible": true,
      "constraint_violations": 0,
      "total_violation": 0,
      "evaluation_status": "success",
      "error": "",
      "objective_score": 0.42444444444444446,
      "pareto": true
    },
    {
      "candidate_id": "candidate-16",
      "carbon_price": 15,
      "investment": 0,
      "cost": 130,
      "emissions": 60,
      "jobs": 46.25,
      "resilience": 43.75,
      "feasible": false,
      "constraint_violations": 1,
      "total_violation": 1.75,
      "evaluation_status": "success",
      "error": "",
      "objective_score": null,
      "pareto": false
    },
    {
      "candidate_id": "candidate-17",
      "carbon_price": 15,
      "investment": 5,
      "cost": 145,
      "emissions": 35,
      "jobs": 53.75,
      "resilience": 48.75,
      "feasible": true,
      "constraint_violations": 0,
      "total_violation": 0,
      "evaluation_status": "success",
      "error": "",
      "objective_score": 0.5005555555555555,
      "pareto": true
    },
    {
      "candidate_id": "candidate-18",
      "carbon_price": 15,
      "investment": 10,
      "cost": 160,
      "emissions": 10,
      "jobs": 61.25,
      "resilience": 53.75,
      "feasible": true,
      "constraint_violations": 0,
      "total_violation": 0,
      "evaluation_status": "success",
      "error": "",
      "objective_score": 0.46277777777777773,
      "pareto": true
    },
    {
      "candidate_id": "candidate-19",
      "carbon_price": 15,
      "investment": 15,
      "cost": 175,
      "emissions": -15,
      "jobs": 68.75,
      "resilience": 58.75,